{
  "id": "synthetic-breakout-data-v0",
  "dataset_name": "Synthetic Breakout Fixture",
  "created_at": "2026-07-09T00:00:00Z",
  "owner": "the-pass",
  "source": {
    "provider": "synthetic-fixture",
    "venue": "synthetic",
    "endpoint_or_file": "inline fixture",
    "license_note": "public-safe synthetic data",
    "raw_path": "",
    "normalized_path": ""
  },
  "coverage": {
    "instruments": ["SYNTH"],
    "start_time": "2026-01-01T00:00:00Z",
    "end_time": "2026-01-31T00:00:00Z",
    "timezone": "UTC",
    "event_time_field": "timestamp",
    "receive_time_field": ""
  },
  "schema": {
    "fields": ["timestamp", "open", "high", "low", "close", "volume"],
    "primary_keys": ["timestamp"],
    "known_null_fields": []
  },
  "quality": {
    "row_count": 31,
    "missing_intervals": [],
    "duplicate_policy": "reject",
    "sequence_gap_policy": "not applicable",
    "cross_source_checks": []
  },
  "fingerprint": {
    "method": "sha256",
    "value": "synthetic-fixture-no-real-data"
  },
  "limitations": ["Synthetic data", "No market microstructure", "No execution evidence"]
}
