{
  "id": "synthetic-random-baseline-data-v0",
  "dataset_name": "Synthetic Random Baseline Fixture",
  "created_at": "2026-07-09T00:00:00Z",
  "owner": "the-pass",
  "source": {
    "provider": "synthetic-random-fixture",
    "venue": "synthetic",
    "endpoint_or_file": "../data/random_signal_fixture.csv",
    "license_note": "public-safe synthetic data",
    "raw_path": "../data/random_signal_fixture.csv",
    "normalized_path": ""
  },
  "coverage": {
    "instruments": ["SYNTH"],
    "start_time": "2026-02-01T00:00:00Z",
    "end_time": "2026-02-12T00:00:00Z",
    "timezone": "UTC",
    "event_time_field": "timestamp",
    "receive_time_field": ""
  },
  "schema": {
    "fields": ["timestamp", "close", "random_signal", "gross_return", "cost", "net_return"],
    "primary_keys": ["timestamp"],
    "known_null_fields": []
  },
  "quality": {
    "row_count": 12,
    "missing_intervals": [],
    "duplicate_policy": "reject",
    "sequence_gap_policy": "not applicable",
    "cross_source_checks": []
  },
  "fingerprint": {
    "method": "sha256",
    "value": "b3f886c4d7ad15f617e9b09cc93b8af3677b3150cbac404ff2c49590bce1b576"
  },
  "limitations": ["Synthetic data", "Negative-control fixture", "No execution evidence"]
}
